agency_name,parent_agency_name,section_1_title,section_2_titleNational Security Agency/Central Security Service,Defense Department,World,National Security Council,,World,National Shipping Authority,Commerce Department,World,Business & IndustryNational Skill Standards Board,,Business & Industry,National Space Council,,Science & Technology,National Technical Information Service,Commerce Department,Science & Technology,National Telecommunications and Information Administration,Commerce Department,Science & Technology,Business & IndustryNational Transportation Safety Board,,Science & Technology,Business & IndustryNational Women's Business Council,,Business & Industry,Natural Resources Conservation Service,Agriculture Department,Environment,Science & TechnologyNavajo and Hopi Indian Relocation Office,,Health & Public Welfare,Navy Department,Defense Department,World,Neighborhood Reinvestment Corporation,,Health & Public Welfare,Northeast Dairy Compact Commission,,Business & Industry,Northeast Interstate Low-Level Radioactive Waste Commission,,Environment,Science & Technology"Nuclear Energy Office, Energy Department",,Environment,Science & TechnologyNuclear Regulatory Commission,,Environment,Science & TechnologyNuclear Waste Negotiator Office,,Environment,Science & TechnologyNuclear Waste Technical Review Board,,Environment,Science & TechnologyOccupational Safety and Health Administration,Labor Department,Business & Industry,Health & Public WelfareOccupational Safety and Health Review Commission,,Business & Industry,Health & Public WelfareOcean Policy Commission,,Environment,Office of Motor Carrier Safety,Transportation Department,Science & Technology,Business & IndustryOffice of National Drug Control Policy,,Health & Public Welfare,Office of Policy Development,,Health & Public Welfare,Office of the Assistant to the President and Chief of Staff,,Health & Public Welfare,Office of the Special Counsel,,Health & Public Welfare,Oklahoma City National Memorial Trust,,Health & Public Welfare,Operations Office,Agriculture Department,Environment,Ounce of Prevention Council,,Health & Public Welfare,Overseas Private Investment Corporation,,World,Oversight Board,,Money,Pacific Northwest Electric Power and Conservation Planning Council,,Business & Industry,Panama Canal Commission,,World,Parole Commission,Justice Department,Health & Public Welfare,Patent and Trademark Office,Commerce Department,Science & Technology,Business & IndustryPeace Corps,,World,Pension and Welfare Benefits Administration,Labor Department,Money,Business & IndustryPension Benefit Guaranty Corporation,,Business & Industry,Personnel Management Office,,Money,Health & Public WelfarePhysician Payment Review Commission,,Business & Industry,Pipeline and Hazardous Materials Safety Administration,Transportation Department,Environment,Business & IndustryPostal Regulatory Commission,,Business & Industry,Postal Service,,Business & Industry,President John F. Kennedy Assassination Records Review Board,,Health & Public Welfare,Presidential Advisory Committee on Gulf War Veterans' Illnesses,,Health & Public Welfare,Presidential Commission on Assignment of Women in the Armed Forces,,World,Health & Public WelfarePresidential Commission on Catastrophic Nuclear Accidents,,Science & Technology,Health & Public WelfarePresidential Commission on the Human Immunodeficiency Virus Epidemic,,Health & Public Welfare,Presidential Commission on the Space Shuttle Challenger Accident,,Science & Technology,Presidential Documents,,,Presidential Task Force on Project Economic Justice,,Business & Industry,President's Commission on Compensation of Career Federal Executives,,Health & Public Welfare,President's Commission on Critical Infrastructure Protection,,World,President's Commission on Executive Exchange,,Health & Public Welfare,President's Commission on Federal Ethics Law Reform,,Health & Public Welfare,President's Commission on Management of A.I.D. Development Programs,,World,President's Commission on Model State Drug Laws,,Health & Public Welfare,President's Commission on Privatization,,Business & Industry,President's Commission on the Federal Appointment Process,,Health & Public Welfare,President's Commission on White House Fellowships,,Money,President's Council on Integrity and Efficiency,,Health & Public Welfare,President's Council on Sustainable Development,,Environment,Science & TechnologyPresident's Critical Infrastructure Protection Board,Faith-based Neighborhood Partnerships Office,World,President's Economic Policy Advisory Board,,Business & Industry,President's Education Policy Advisory Committee,,Health & Public Welfare,President's Outer Continental Shelf Leasing and Development Task Force,,Environment,President's Special Review Board,,World,President's Task Force on National Health Care Reform,,Health & Public Welfare,Presidio Trust,,Environment,Health & Public WelfarePrisons Bureau,Justice Department,Health & Public Welfare,Privacy and Civil Liberties Oversight Board,,Health & Public Welfare,Program Support Center,Health and Human Services Department,Health & Public Welfare,Prospective Payment Assessment Commission,,Health & Public Welfare,Public Debt Bureau,Treasury Department,Money,Public Health Service,Health and Human Services Department,,Railroad Accounting Principles Board,,Business & Industry,Railroad Retirement Board,,Business & Industry,Reagan-Udall Foundation,,Money,Reclamation Bureau,Interior Department,Environment,Business & IndustryRecovery Accountability and Transparency Board,,Money,Refugee Resettlement Office,Health and Human Services Department,World,Regulatory Information Service Center,,Health & Public Welfare,Research and Innovative Technology Administration,Transportation Department,Science & Technology,Business & IndustryResearch and Special Programs Administration,Transportation Department,Science & Technology,Resolution Trust Corporation,,Money,Revenue Sharing Office,Treasury Department,Money,Risk Management Agency,Agriculture Department,Money,Roosevelt Campobello International Park Commission,,Environment,Health & Public WelfareRural Business-Cooperative Service,Agriculture Department,Business & Industry,Rural Housing and Community Development Service,Agriculture Department,Health & Public Welfare,Rural Housing Service,Agriculture Department,Health & Public Welfare,Rural Telephone Bank,Agriculture Department,Science & Technology,Business & IndustryRural Utilities Service,Agriculture Department,Science & Technology,Business & IndustrySaint Elizabeths Hospital,Health and Human Services Department,Health & Public Welfare,Saint Lawrence Seaway Development Corporation,Transportation Department,Environment,"Science and Education, Office of Director for",Agriculture Department,Science & Technology,Science and Technology Policy Office,,Science & Technology,Secret Service,Homeland Security Department,Money,WorldSecurities and Exchange Commission,,Money,Business & IndustrySelective Service System,,World,Small Business Administration,,Money,Business & IndustrySmithsonian Institution,,Health & Public Welfare,Social Security Administration,,Money,Business & IndustrySoutheastern Power Administration,Energy Department,Environment,Business & IndustrySouthwestern Power Administration,Energy Department,Environment,Business & IndustrySpecial Counsel Office,,Health & Public Welfare,Special Inspector General For Iraq Reconstruction,,World,Special Trustee for American Indians Office,Interior Department,Health & Public Welfare,State Department,,World,State Justice Institute,,Health & Public Welfare,Strategic Environmental Research and Development Program Scientific Advisory Board,,Environment,Science & TechnologySubstance Abuse and Mental Health Services Administration,Health and Human Services Department,Health & Public Welfare,Surface Mining Reclamation and Enforcement Office,Interior Department,Environment,Business & IndustrySurface Transportation Board,Transportation Department,Business & Industry,Susquehanna River Basin Commission,,Environment,Business & IndustrySynthetic Fuels Corporation,,Science & Technology,Technology Administration,Commerce Department,Science & Technology,Technology Assessment Office,,Science & Technology,Tennessee Valley Authority,,Environment,Business & IndustryThe White House Office,,Health & Public Welfare,Thrift Depositor Protection Oversight Board,,Money,Thrift Supervision Office,Treasury Department,Money,Business & IndustryTrade and Development Agency,,World,Business & Industry"Trade Representative, Office of United States",,World,Business & IndustryTransportation Department,,Science & Technology,Business & Industry"Transportation Office, Agriculture Department",Agriculture Department,Business & Industry,Transportation Security Administration,Homeland Security Department,World,Business & IndustryTransportation Statistics Bureau,Transportation Department,Business & Industry,Travel and Tourism Administration,Commerce Department,World,Business & IndustryTreasury Department,,Money,Twenty-First Century Workforce Commission,,Business & Industry,U.S. Citizenship and Immigration Services,Homeland Security Department,World,U.S. Commission on Improving Effectiveness of United Nations,,World,U.S. Customs and Border Protection,Homeland Security Department,World,U.S. House of Representatives,,Health & Public Welfare,U.S. Immigration and Customs Enforcement,Homeland Security Department,World,Business & IndustryU.S. Trade Deficit Review Commission,,World,U.S.-China Economic and Security Review Commission,,World,Uniformed Services University of the Health Sciences,Defense Department,World,Health & Public WelfareUnited States Claims Court,,Health & Public Welfare,United States Court of Veterans Appeals,,Health & Public Welfare,United States Enrichment Corporation,,Science & Technology,United States Information Agency,,World,United States Institute of Peace,,World,United States Marshals Service,Justice Department,Health & Public Welfare,United States Mint,Treasury Department,Money,United States Railway Association,,Business & Industry,United States Sentencing Commission,,Health & Public Welfare,United States--Pacific Trade and Investment Policy Commission,,World,Urban Reinvestment Task Force,,Health & Public Welfare,Utah Reclamation Mitigation and Conservation Commission,,Environment,Valles Caldera Trust,,Environment,Veterans Affairs Department,,Health & Public Welfare,Veterans Employment and Training Service,Labor Department,Business & Industry,Health & Public WelfareVice President of the United States,,Health & Public Welfare,Victims of Crime Office,Justice Department,Health & Public Welfare,Wage and Hour Division,Labor Department,Business & Industry,Western Area Power Administration,Energy Department,Environment,Business & IndustryWhite House Conference for a Drug Free America,,Health & Public Welfare,White House Office of Public Liaison,,Health & Public Welfare,Women's Business Enterprise Interagency Committee,,Business & IndustryWomen's Progress Commemoration Commission,,Health & Public WelfareWorkers Compensation Programs Office,Labor Department,Business & IndustryWorld Agricultural Outlook Board,Agriculture Department,World