agency_name,parent_agency_name,section_1_title,section_2_titleAction,,Health & Public Welfare,"Administration Office, Executive Office of the President",,Health & Public Welfare,Administrative Office of United States Courts,,Health & Public Welfare,African Development Foundation,,World,Agency for Healthcare Research and Quality,Health and Human Services Department,Health & Public Welfare,Agency for International Development,,World,Agency for Toxic Substances and Disease Registry,Health and Human Services Department,Health & Public Welfare,Aging Administration,Health and Human Services Department,Health & Public Welfare,Agricultural Marketing Service,Agriculture Department,Business & Industry,Agricultural Research Service,Agriculture Department,Science & Technology,Agricultural Trade and Export Policy National Commission,,World,Agriculture Department,,Science & Technology,Business & IndustryAir Force Department,Defense Department,World,Science & TechnologyAir Quality National Commission,,Environment,Air Transportation Stabilization Board,,Business & Industry,"Alaska Natural Gas Transportation System, Office of Federal Inspector",,Science & Technology,Alaska Power Administration,Energy Department,Environment,Business & IndustryAlcohol and Tobacco Tax and Trade Bureau,Treasury Department,Money,Business & Industry"Alcohol, Tobacco, Firearms, and Explosives Bureau",Justice Department,Health & Public Welfare,American Battle Monuments Commission,,Health & Public Welfare,Amtrak Reform Council,,Business & Industry,Animal and Plant Health Inspection Service,Agriculture Department,Business & Industry,Health & Public WelfareAntitrust Division,Justice Department,Money,Business & IndustryAntitrust Modernization Commission,,Money,Business & IndustryAppalachian Regional Commission,,Health & Public Welfare,Appalachian States Low-Level Radioactive Waste Commission,,Environment,Architect of the Capitol,,Health & Public Welfare,Architectural and Transportation Barriers Compliance Board,,Health & Public Welfare,Arctic Research Commission,,Science & Technology,Armed Forces Retirement Home,,Health & Public Welfare,Arms Control and Disarmament Agency,,World,Army Department,Defense Department,World,Science & TechnologyAssassination Records Review Board,,Health & Public Welfare,"Audit Office, Agriculture Department",Agriculture Department,,Aviation Safety Commission,,Science & Technology,Health & Public WelfareBarry M. Goldwater Scholarship and Excellence in Education Foundation,,Money,"Benefits Review Board, Labor Department",Labor Department,Money,Business & IndustryBipartisan Commission on Entitlement and Tax Reform,,Money,Business & IndustryBoard of Directors of the Hope for Homeowners Program,,Health & Public Welfare,Bonneville Power Administration,Energy Department,Environment,Science & TechnologyBroadcasting Board of Governors,,Science & Technology,Census Bureau,Commerce Department,Business & Industry,Health & Public WelfareCensus Monitoring Board,,Business & Industry,Health & Public WelfareCenters for Disease Control and Prevention,Health and Human Services Department,Science & Technology,Health & Public WelfareCenters for Medicare & Medicaid Services,Health and Human Services Department,Health & Public Welfare,Central Intelligence Agency,,World,Chemical Safety and Hazard Investigation Board,,Environment,Health & Public WelfareChild Support Enforcement Office,Health and Human Services Department,Money,Health & Public WelfareChildren and Families Administration,Health and Human Services Department,Health & Public Welfare,Christopher Columbus Quincentenary Jubilee Commission,,Health & Public Welfare,Civil Liberties Public Education Fund Board,,Health & Public Welfare,Civil Rights Commission,,Health & Public Welfare,Coast Guard,Homeland Security Department,Environment,WorldCommerce Department,,Business & Industry,Science & TechnologyCommercial Space Transportation Office,Transportation Department,Science & Technology,Business & IndustryCommission for the Improvement of the Federal Crop Insurance Program,,Money,Business & IndustryCommission of Fine Arts,,Health & Public Welfare,Commission on Agricultural Workers,,Business & Industry,Commission on Education of the Deaf,,Health & Public Welfare,"Commission on Executive, Legislative, and Judicial Salaries",,Money,Health & Public WelfareCommission on Immigration Reform,,World,Commission on Interstate Child Support,,Money,Health & Public WelfareCommission on Merchant Marine and Defense,,World,Commission on Minority Business Development,,Business & Industry,Commission on Protecting and Reducing Government Secrecy,,Health & Public Welfare,Commission on Railroad Retirement Reform,,Business & Industry,Commission on Review of Overseas Military Facility Structure of the United States,,World,Commission on Structural Alternatives for the Federal Courts of Appeals,,Health & Public Welfare,Commission on the Advancement of Federal Law Enforcement,,Health & Public Welfare,Commission on the Bicentennial of the United States Constitution,,Health & Public Welfare,Commission on the Future of the United States Aerospace Industry,,Science & Technology,Commission on the Social Security Notch Issue,,Money,Commission on the Ukraine Famine,,World,Committee for Purchase From People Who Are Blind or Severely Disabled,,Business & Industry,Committee for the Implementation of Textile Agreements,,World,Business & IndustryCommodity Credit Corporation,Agriculture Department,Money,Business & IndustryCommodity Futures Trading Commission,,Money,Business & IndustryCommunity Development Financial Institutions Fund,Treasury Department,Money,Business & IndustryCompetitiveness Policy Council,,Business & Industry,Comptroller of the Currency,Treasury Department,Money,Business & IndustryCongressional Budget Office,,Money,Consumer Affairs Council,,Health & Public Welfare,Consumer Affairs Office,Health and Human Services Department,Health & Public Welfare,Consumer Product Safety Commission,,Business & Industry,Health & Public Welfare"Cooperative State Research, Education, and Extension Service",Agriculture Department,Science & Technology,Coordinating Council on Juvenile Justice and Delinquency Prevention,,Health & Public Welfare,"Copyright Office, Library of Congress",Library of Congress,Business & Industry,Copyright Royalty Board,Library of Congress,Business & Industry,"Copyright Royalty Judges, Library of Congress",,Business & Industry,Copyright Royalty Tribunal,,Business & Industry,Corporation for National and Community Service,,Health & Public Welfare,Council on Environmental Quality,,Environment,Business & IndustryCounsel to the President,,Health & Public Welfare,Court Services and Offender Supervision Agency for the District of Columbia,,Health & Public Welfare,"Crime and Security in U.S. Seaports, Interagency Commission",,Health & Public Welfare,Customs Service,Treasury Department,Money,WorldDefense Acquisition Regulations System,Defense Department,,Defense Audit Service,Defense Department,Money,Defense Base Closure and Realignment Commission,,Business & Industry,Defense Communications Agency,,Science & Technology,Defense Contract Audit Agency,Defense Department,,Defense Criminal Investigative Service,Defense Department,Health & Public Welfare,Defense Department,,World,Defense Information Systems Agency,Defense Department,,Defense Intelligence Agency,Defense Department,,Defense Investigative Service,Defense Department,Health & Public Welfare,Defense Logistics Agency,Defense Department,World,Defense Mapping Agency,Defense Department,,Defense Nuclear Facilities Safety Board,,World,Health & Public WelfareDefense Special Weapons Agency,Defense Department,World,Science & TechnologyDefense Supply Agency,Defense Department,Money,WorldDelaware River Basin Commission,,Environment,Denali Commission,,,Depository Institutions Deregulation Committee,,Money,Business & IndustryDisability Employment Policy Office,Labor Department,Business & Industry,Health & Public WelfareDrug Enforcement Administration,Justice Department,Health & Public Welfare,East-West Foreign Trade Board,,World,Business & IndustryEconomic Analysis Bureau,Commerce Department,World,Business & IndustryEconomic Analysis Staff,Agriculture Department,,Economic Development Administration,Commerce Department,Business & Industry,"Economic Opportunity, National Advisory Council",,Business & Industry,Economic Regulatory Administration,Energy Department,Business & Industry,Economic Research Service,Agriculture Department,Business & Industry,Economics and Statistics Administration,Commerce Department,Business & Industry,Economics Management Staff,Agriculture Department,,Education Department,,Money,Health & Public WelfareElection Assistance Commission,,Health & Public Welfare,Electronic Commerce Advisory Commission,,Business & Industry,Emergency Oil and Gas Guaranteed Loan Board,,Money,Emergency Steel Guarantee Loan Board,,Money,Employee Benefits Security Administration,Labor Department,Business & Industry,Health & Public WelfareEmployees Compensation Appeals Board,Labor Department,Business & Industry,Employment and Training Administration,Labor Department,Business & Industry,Health & Public WelfareEmployment Standards Administration,Labor Department,Business & Industry,Health & Public WelfareEndangered Species Committee,,Environment,Energy Department,,Environment,Science & TechnologyEnergy Efficiency and Renewable Energy Office,Energy Department,Environment,Science & TechnologyEnergy Information Administration,Energy Department,Environment,Science & Technology"Energy Policy and New Uses Office, Agriculture Department",Agriculture Department,Environment,Science & TechnologyEnergy Research Office,Energy Department,Environment,Science & TechnologyEnergy Technology Office,Energy Department,Environment,Science & TechnologyEngineers Corps,Defense Department,Environment,Engraving and Printing Bureau,Treasury Department,Money,"Environment Office, Energy Department",Energy Department,Environment,Science & TechnologyEnvironmental Protection Agency,,Environment,Science & Technology"Environmental Quality Office, Agriculture Department",Agriculture Department,Environment,Science & TechnologyEqual Employment Opportunity Commission,,Business & Industry,Health & Public WelfareExecutive Council on Integrity and Efficiency,,Business & Industry,Health & Public WelfareExecutive Office for Immigration Review,Justice Department,World,Health & Public WelfareExport Administration Bureau,Commerce Department,World,Business & IndustryExport-Import Bank,,Money,WorldFaith-based Neighborhood Partnerships Office,,Health & Public Welfare,Family Assistance Office,Health and Human Services Department,Health & Public Welfare,Farm Credit Administration,,Money,Business & IndustryFarm Credit System Assistance Board,,Money,Business & IndustryFarm Credit System Insurance Corporation,,Money,Business & IndustryFarm Service Agency,Agriculture Department,Money,Business & IndustryFederal Accounting Standards Advisory Board,,Money,Federal Aviation Administration,Transportation Department,Science & Technology,Business & IndustryFederal Bureau of Investigation,Justice Department,World,Health & Public WelfareFederal Communications Commission,,Science & Technology,Business & IndustryFederal Contract Compliance Programs Office,Labor Department,Money,Federal Crop Insurance Corporation,Agriculture Department,Environment,Business & IndustryFederal Deposit Insurance Corporation,,Money,Business & IndustryFederal Election Commission,,Health & Public Welfare,Federal Emergency Management Agency,Homeland Security Department,World,Health & Public WelfareFederal Energy Regulatory Commission,Energy Department,Environment,Science & TechnologyFederal Financial Institutions Examination Council,,Money,Federal Financing Bank,Treasury Department,Money,Federal Highway Administration,Transportation Department,Business & Industry,Federal Home Loan Bank Board,,Money,Federal Home Loan Mortgage Corporation,,Money,Federal Housing Enterprise Oversight Office,Housing and Urban Development Department,Health & Public Welfare,Federal Housing Finance Agency,,Money,Federal Housing Finance Board,,Money,Business & IndustryFederal Labor Relations Authority,,Business & Industry,Federal Law Enforcement Training Center,Homeland Security Department,World,Federal Maritime Commission,,World,Business & IndustryFederal Mediation and Conciliation Service,,Business & Industry,Federal Mine Safety and Health Review Commission,,Health & Public Welfare,Federal Motor Carrier Safety Administration,Transportation Department,Business & Industry,"Federal Pay, Advisory Committee",,Money,Federal Prison Industries,Justice Department,Business & Industry,Federal Procurement Policy Office,Management and Budget Office,Money,Federal Railroad Administration,Transportation Department,Business & Industry,Federal Register Office,National Archives and Records Administration,Health & Public Welfare,"Federal Register, Administrative Committee",,Health & Public Welfare,Federal Reserve System,,Money,Business & IndustryFederal Retirement Thrift Investment Board,,Money,Business & IndustryFederal Service Impasses Panel,,Health & Public Welfare,Federal Statistical Policy and Standards Office,Commerce Department,Business & Industry,Federal Trade Commission,,Business & Industry,Federal Transit Administration,Transportation Department,Business & Industry,Financial Crimes Enforcement Network,Treasury Department,Money,Health & Public WelfareFinancial Crisis Inquiry Commission,,Money,Business & IndustryFiscal Service,Treasury Department,Money,Fish and Wildlife Service,Interior Department,Environment,Business & IndustryFood and Consumer Service,Agriculture Department,Health & Public Welfare,Food and Drug Administration,Health and Human Services Department,Business & Industry,Health & Public WelfareFood and Nutrition Service,Agriculture Department,Health & Public Welfare,Food Safety and Inspection Service,Agriculture Department,Business & Industry,Health & Public WelfareForeign Agricultural Service,Agriculture Department,World,Foreign Assets Control Office,Treasury Department,Money,WorldForeign Claims Settlement Commission,Justice Department,Money,WorldForeign Service Grievance Board,,World,Foreign Service Impasse Disputes Panel,,World,Foreign Service Labor Relations Board,,World,Foreign-Trade Zones Board,Commerce Department,World,Business & IndustryForest Service,Agriculture Department,Environment,Business & IndustryGeneral Services Administration,,Money,Geographic Names Board,,Environment,Geological Survey,Interior Department,Environment,Science & TechnologyGovernment Accountability Office,,Money,Government Accountability Office,,,Government Ethics Office,,Health & Public Welfare,Government National Mortgage Association,Housing and Urban Development Department,Money,Government Printing Office,,Health & Public Welfare,"Grain Inspection, Packers and Stockyards Administration",Agriculture Department,Business & Industry,Health & Public WelfareGrants and Program Systems Office,Agriculture Department,Money,Harry S. Truman Scholarship Foundation,,Money,Health and Human Services Department,,Health & Public Welfare,Health Resources and Services Administration,Health and Human Services Department,Health & Public Welfare,"Hearings and Appeals Office, Energy Department",Energy Department,Health & Public Welfare,"Hearings and Appeals Office, Interior Department",Interior Department,Health & Public Welfare,"Historic Preservation, Advisory Council",,Environment,Holocaust Memorial Council,,Health & Public Welfare,Homeland Security Department,,World,Housing and Urban Development Department,,Money,Health & Public WelfareHuman Development Services Office,Health and Human Services Department,Health & Public Welfare,Human Nutrition Information Service,Agriculture Department,Health & Public Welfare,"Human Radiation Experiments, Advisory Committee",,Science & Technology,Health & Public WelfareImmigration and Naturalization Service,Justice Department,World,Independent Counsel Office,,Health & Public Welfare,Indian Affairs Bureau,Interior Department,Health & Public Welfare,Indian Arts and Crafts Board,,Health & Public Welfare,Indian Education National Advisory Council,,Health & Public Welfare,Indian Health Service,Health and Human Services Department,Health & Public Welfare,Indian Trust Transition Office,Interior Department,Money,"Industrial Economics Bureau, Commerce Department",Commerce Department,Business & Industry,"Industrial Economics Office, Treasury Department",Treasury Department,Business & Industry,Industry and Security Bureau,Commerce Department,World,Business & Industry"Information Resources Management Office, Agriculture Department",Agriculture Department,Environment,Science & TechnologyInformation Security Oversight Office,National Archives and Records Administration,Health & Public Welfare,"Inspector General Office, Agriculture Department",Agriculture Department,Health & Public Welfare,"Inspector General Office, Health and Human Services Department",Centers for Medicare & Medicaid Services,Health & Public Welfare,Institute of American Indian and Alaska Native Culture and Arts Development,,Health & Public Welfare,Interagency Coordinating Council,,Health & Public Welfare,Interagency Environmental Technology Export Group,,Environment,Science & TechnologyInteragency Floodplain Management Review Committee,,Environment,Inter-American Foundation,,World,Intergovernmental and Institutional Relations Office (DOE),Energy Department,Health & Public Welfare,Intergovernmental Relations Advisory Commission,,Health & Public Welfare,Interior Department,,Environment,Internal Revenue Service,Treasury Department,Money,Business & Industry"International Boundary and Water Commission, United States and Mexico",,Environment,WorldInternational Broadcasting Board,,World,International Cultural and Trade Center Commission,,World,International Development Cooperation Agency,Agency for International Development,World,International Investment Office,Treasury Department,Money,WorldInternational Joint Commission-United States and Canada,,World,International Trade Administration,Commerce Department,World,Business & IndustryInternational Trade Commission,,World,Business & IndustryJames Madison Memorial Fellowship Foundation,,Money,Japan-United States Friendship Commission,,World,Joint Board for Enrollment of Actuaries,,Money,Judicial Conference of the United States,,Health & Public Welfare,Judicial Review Commission on Foreign Asset Control,,Health & Public Welfare,Justice Department,,Health & Public Welfare,Justice Programs Office,Justice Department,,Juvenile Justice and Delinquency Prevention Office,Justice Department,,Labor Department,,Business & Industry,Labor Statistics Bureau,Labor Department,Business & Industry,Labor-Management Relations and Cooperative Programs Bureau,Labor Department,Business & Industry,Labor-Management Standards Office,Labor Department,Business & Industry,Land Management Bureau,Interior Department,Environment,Business & IndustryLegal Services Corporation,,Health & Public Welfare,Library of Congress,,Health & Public Welfare,Local Television Loan Guarantee Board,,Money,Science & TechnologyLower Mississippi Delta Development Commission,,Environment,Management and Budget Office,,Money,Marine Mammal Commission,,Environment,Maritime Administration,Transportation Department,Business & Industry,"Martin Luther King, Jr. Federal Holiday Commission",,Health & Public Welfare,Medicare Payment Advisory Commission,,Business & Industry,Health & Public WelfareMerit Systems Protection Board,,Business & Industry,Micronesian Status Negotiations Office,,World,Millennium Challenge Corporation,,World,Mine Safety and Health Administration,Labor Department,Health & Public Welfare,Minerals Management Service,Interior Department,Environment,Business & IndustryMines Bureau,Interior Department,Environment,Business & IndustryMinority Business Development Agency,Commerce Department,Business & Industry,Minority Economic Impact Office,Energy Department,Health & Public Welfare,Mississippi River Commission,,Environment,Monetary Offices,Treasury Department,Money,Monitored Retrievable Storage Review Commission,,Environment,Morris K. Udall Scholarship and Excellence in National Environmental Policy Foundation,,Money,National  Nuclear Security Administration,Energy Department,Environment,Science & TechnologyNational Acid Precipitation Assessment Program,,Environment,Science & TechnologyNational Advisory Commission on Law Enforcement,,Health & Public Welfare,National Advisory Council on the Public Service,,Health & Public Welfare,National Aeronautics and Space Administration,,Science & Technology,National Agricultural Library,Agriculture Department,Science & Technology,National Agricultural Statistics Service,Agriculture Department,Science & Technology,National Archives and Records Administration,,Health & Public Welfare,National Bankruptcy Review Commission,,Money,National Biological Service,Interior Department,Science & Technology,Health & Public WelfareNational Bipartisan Commission on Future of Medicare,,Health & Public Welfare,National Capital Planning Commission,,Environment,National Civilian Community Corps,Interior Department,Health & Public Welfare,National Commission for Employment Policy,,Business & Industry,National Commission on Acquired Immune Deficiency Syndrome,,Health & Public Welfare,"National Commission on American Indian, Alaskan Native and Hawaiian Native Housing",,Health & Public Welfare,National Commission on America's Urban Families,,Health & Public Welfare,National Commission on Children,,Health & Public Welfare,National Commission on Drug-Free Schools,,Health & Public Welfare,"National Commission on Financial Institution Reform, Recovery, and Enforcement",,Money,Business & IndustryNational Commission on Fiscal Responsibility and Reform,"Administration Office, Executive Office of the President",Money,Business & IndustryNational Commission on Intermodal Transportation,,Business & Industry,National Commission on Judicial Discipline and Removal,,Health & Public Welfare,National Commission on Libraries and Information Science,,Health & Public Welfare,National Commission on Manufactured Housing,,Health & Public Welfare,National Commission on Migrant Education,,Health & Public Welfare,National Commission on Restructuring the Internal Revenue Service,,Money,National Commission on Severely Distressed Public Housing,,Health & Public Welfare,National Commission on Terrorist Attacks Upon the United States,,World,National Commission on the Cost of Higher Education,,Money,National Commission To Ensure Strong Competitive Airline Industry,,Business & Industry,National Commission to Prevent Infant Mortality,,Health & Public Welfare,National Communications System,Homeland Security Department,World,Science & TechnologyNational Consumer Cooperative Bank,,Money,National Council on Disability,,Health & Public Welfare,National Council on Public Works Improvement,,Health & Public Welfare,National Council on the Handicapped,,Health & Public Welfare,National Counterintelligence Center,,World,National Credit Union Administration,,Money,National Crime Prevention and Privacy Compact Council,,Health & Public Welfare,National Critical Materials Council,,Science & Technology,National Drug Control Policy Office,,Health & Public Welfare,National Economic Commission,,Business & Industry,National Economic Council,,Business & Industry,National Education Goals Panel,,Health & Public Welfare,National Foundation on the Arts and the Humanities,,Health & Public Welfare,National Gambling Impact Study Commission,,Health & Public Welfare,National Geospatial-Intelligence Agency,Defense Department,World,Science & TechnologyNational Highway Traffic Safety Administration,Transportation Department,Science & Technology,Business & IndustryNational Historical Publications and Records Commission,National Archives and Records Administration,Health & Public Welfare,National Indian Gaming Commission,Interior Department,Business & Industry,National Institute for Literacy,,Health & Public Welfare,National Institute of Corrections,Justice Department,Health & Public Welfare,National Institute of Food and Agriculture,Agriculture Department,Science & Technology,Health & Public WelfareNational Institute of Justice,Justice Department,Health & Public Welfare,National Institute of Standards and Technology,Commerce Department,Science & Technology,National Institutes of Health,Health and Human Services Department,Science & Technology,Health & Public Welfare"National Intelligence, Office of the National Director",,World,National Labor Relations Board,,Business & Industry,National Library of Medicine,Health and Human Services Department,Science & Technology,Health & Public WelfareNational Mediation Board,,Business & Industry,National Nanotechnology Coordination Office,,Science & Technology,National Nuclear Security Administration,Energy Department,Environment,Science & TechnologyNational Occupational Information Coordinating Committee,,Business & Industry,National Oceanic and Atmospheric Administration,Commerce Department,Environment,Science & TechnologyNational Park Service,Interior Department,Environment,Health & Public WelfareNational Partnership for Reinventing Government,,Health & Public Welfare,National Prison Rape Elimination Commission,,Health & Public Welfare,National Railroad Passenger Corporation,,Business & Industry,National Science Foundation,,Science & Technology,